{
  "schema": "org.mura.flash.replay-scenario/v1",
  "id": "samsung-download-write-interruption",
  "procedureId": "samsung-galaxy-xr-ayke-to-ayia-rollback-unlock",
  "flowId": "ayke-to-ayia-rollback",
  "simulateDisabled": true,
  "clock": {
    "startTimestamp": "2026-09-27T12:00:00.000Z",
    "tickMs": 10
  },
  "operationDurations": [
    {
      "operationId": "probe-model",
      "durationMs": 100
    },
    {
      "operationId": "probe-build",
      "durationMs": 110
    },
    {
      "operationId": "probe-csc",
      "durationMs": 120
    },
    {
      "operationId": "enter-download-mode",
      "durationMs": 130
    },
    {
      "operationId": "observe-download-u1",
      "durationMs": 140
    },
    {
      "operationId": "inspect-ayia-package",
      "durationMs": 150
    },
    {
      "operationId": "flash-ayia-full-package",
      "durationMs": 160
    }
  ],
  "adapterCapabilities": [],
  "inputs": [
    {
      "name": "device",
      "type": "device-ref",
      "value": "simulated-sm-i610"
    },
    {
      "name": "expected-csc",
      "type": "string",
      "value": "SIM"
    },
    {
      "name": "expected-source-build",
      "type": "string",
      "value": "I610UEU1AYKE"
    },
    {
      "name": "expected-current-binary",
      "type": "string",
      "value": "Samsung Official"
    },
    {
      "name": "expected-system-status",
      "type": "string",
      "value": "Official"
    },
    {
      "name": "expected-oem-lock",
      "type": "string",
      "value": "ON"
    },
    {
      "name": "expected-frp-lock",
      "type": "string",
      "value": "OFF"
    },
    {
      "name": "expected-kg-status",
      "type": "string",
      "value": "NORMAL"
    },
    {
      "name": "expected-secure-download",
      "type": "string",
      "value": "ENABLED"
    },
    {
      "name": "ayia-full-package",
      "type": "artifact-ref",
      "value": "simulated-user-supplied-ayia-package"
    },
    {
      "name": "confirm-simulated-full-package-write",
      "type": "boolean",
      "value": true
    }
  ],
  "responses": [
    {
      "kind": "success",
      "operationId": "probe-model",
      "outputs": [
        {
          "name": "value",
          "type": "string",
          "value": "SM-I610"
        }
      ]
    },
    {
      "kind": "success",
      "operationId": "probe-build",
      "outputs": [
        {
          "name": "value",
          "type": "string",
          "value": "I610UEU1AYKE"
        }
      ]
    },
    {
      "kind": "success",
      "operationId": "probe-csc",
      "outputs": [
        {
          "name": "value",
          "type": "string",
          "value": "SIM"
        }
      ]
    },
    {
      "kind": "success",
      "operationId": "enter-download-mode",
      "outputs": [
        {
          "name": "acknowledged",
          "type": "boolean",
          "value": true
        }
      ]
    },
    {
      "kind": "success",
      "operationId": "observe-download-u1",
      "outputs": [
        {
          "name": "productName",
          "type": "string",
          "value": "SM-I610"
        },
        {
          "name": "csc",
          "type": "string",
          "value": "SIM"
        },
        {
          "name": "currentBinary",
          "type": "string",
          "value": "Samsung Official"
        },
        {
          "name": "systemStatus",
          "type": "string",
          "value": "Official"
        },
        {
          "name": "oemLock",
          "type": "string",
          "value": "ON"
        },
        {
          "name": "frpLock",
          "type": "string",
          "value": "OFF"
        },
        {
          "name": "kgStatus",
          "type": "string",
          "value": "NORMAL"
        },
        {
          "name": "rpSwrev",
          "type": "string",
          "value": "U1"
        },
        {
          "name": "secureDownload",
          "type": "string",
          "value": "ENABLED"
        }
      ]
    },
    {
      "kind": "success",
      "operationId": "inspect-ayia-package",
      "outputs": [
        {
          "name": "verifiedPackage",
          "type": "verified-artifact-ref",
          "value": "verified-ayia-package"
        },
        {
          "name": "actualDigest",
          "type": "digest",
          "value": "e971d250393920bcc63b3093f59806f3c111bb30b41acc12caf8bac77e6e8584"
        },
        {
          "name": "model",
          "type": "string",
          "value": "SM-I610"
        },
        {
          "name": "csc",
          "type": "string",
          "value": "SIM"
        },
        {
          "name": "targetBuild",
          "type": "string",
          "value": "I610UEU1AYIA"
        },
        {
          "name": "targetSwrev",
          "type": "string",
          "value": "U1"
        }
      ]
    },
    {
      "kind": "success",
      "operationId": "flash-ayia-full-package",
      "outputs": [
        {
          "name": "result",
          "type": "string",
          "value": "PASS"
        },
        {
          "name": "writeStarted",
          "type": "boolean",
          "value": true
        }
      ]
    },
    {
      "kind": "interruption",
      "afterOperationId": "flash-ayia-full-package"
    }
  ],
  "expected": {
    "terminalStateId": "package-inspected",
    "eventKinds": [
      "session-start",
      "confirmation",
      "operation-would-execute",
      "operation-success",
      "operation-would-execute",
      "operation-success",
      "operation-would-execute",
      "operation-success",
      "operation-would-execute",
      "operation-success",
      "operation-would-execute",
      "state-transition",
      "operation-success",
      "operation-would-execute",
      "state-transition",
      "operation-success",
      "operation-would-execute",
      "operation-failure",
      "session-end"
    ],
    "errorCode": "interrupted"
  }
}
