{
  "schema": "org.mura.flash.replay-scenario/v1",
  "id": "samsung-u2-rollback-refusal",
  "procedureId": "samsung-galaxy-xr-ayke-to-ayia-rollback-unlock",
  "flowId": "u2-rollback-protected",
  "simulateDisabled": true,
  "clock": {
    "startTimestamp": "2026-09-27T12:00:00.000Z",
    "tickMs": 10
  },
  "operationDurations": [
    {
      "operationId": "probe-model",
      "durationMs": 100
    },
    {
      "operationId": "probe-build",
      "durationMs": 110
    },
    {
      "operationId": "probe-csc",
      "durationMs": 120
    },
    {
      "operationId": "enter-download-mode",
      "durationMs": 130
    },
    {
      "operationId": "observe-download-u2",
      "durationMs": 140
    },
    {
      "operationId": "refuse-u2-to-u1-rollback",
      "durationMs": 150
    }
  ],
  "adapterCapabilities": [],
  "inputs": [
    {
      "name": "device",
      "type": "device-ref",
      "value": "simulated-sm-i610"
    },
    {
      "name": "expected-csc",
      "type": "string",
      "value": "SIM"
    },
    {
      "name": "expected-source-build",
      "type": "string",
      "value": "I610UEU2AZCI"
    },
    {
      "name": "expected-current-binary",
      "type": "string",
      "value": "Samsung Official"
    },
    {
      "name": "expected-system-status",
      "type": "string",
      "value": "Official"
    },
    {
      "name": "expected-oem-lock",
      "type": "string",
      "value": "ON"
    },
    {
      "name": "expected-frp-lock",
      "type": "string",
      "value": "OFF"
    },
    {
      "name": "expected-kg-status",
      "type": "string",
      "value": "NORMAL"
    },
    {
      "name": "expected-secure-download",
      "type": "string",
      "value": "ENABLED"
    },
    {
      "name": "ayia-full-package",
      "type": "artifact-ref",
      "value": "simulated-user-supplied-ayia-package"
    }
  ],
  "responses": [
    {
      "kind": "success",
      "operationId": "probe-model",
      "outputs": [
        {
          "name": "value",
          "type": "string",
          "value": "SM-I610"
        }
      ]
    },
    {
      "kind": "success",
      "operationId": "probe-build",
      "outputs": [
        {
          "name": "value",
          "type": "string",
          "value": "I610UEU2AZCI"
        }
      ]
    },
    {
      "kind": "success",
      "operationId": "probe-csc",
      "outputs": [
        {
          "name": "value",
          "type": "string",
          "value": "SIM"
        }
      ]
    },
    {
      "kind": "success",
      "operationId": "enter-download-mode",
      "outputs": [
        {
          "name": "acknowledged",
          "type": "boolean",
          "value": true
        }
      ]
    },
    {
      "kind": "success",
      "operationId": "observe-download-u2",
      "outputs": [
        {
          "name": "productName",
          "type": "string",
          "value": "SM-I610"
        },
        {
          "name": "csc",
          "type": "string",
          "value": "SIM"
        },
        {
          "name": "currentBinary",
          "type": "string",
          "value": "Samsung Official"
        },
        {
          "name": "systemStatus",
          "type": "string",
          "value": "Official"
        },
        {
          "name": "oemLock",
          "type": "string",
          "value": "ON"
        },
        {
          "name": "frpLock",
          "type": "string",
          "value": "OFF"
        },
        {
          "name": "kgStatus",
          "type": "string",
          "value": "NORMAL"
        },
        {
          "name": "rpSwrev",
          "type": "string",
          "value": "U2"
        },
        {
          "name": "secureDownload",
          "type": "string",
          "value": "ENABLED"
        }
      ]
    },
    {
      "kind": "success",
      "operationId": "refuse-u2-to-u1-rollback",
      "outputs": [
        {
          "name": "acknowledged",
          "type": "boolean",
          "value": true
        }
      ]
    }
  ],
  "expected": {
    "terminalStateId": "rollback-protected",
    "eventKinds": [
      "session-start",
      "operation-would-execute",
      "operation-success",
      "operation-would-execute",
      "operation-success",
      "operation-would-execute",
      "operation-success",
      "operation-would-execute",
      "operation-success",
      "operation-would-execute",
      "state-transition",
      "operation-success",
      "operation-would-execute",
      "state-transition",
      "operation-success",
      "session-end"
    ],
    "errorCode": null
  }
}
