{
  "schema": "org.mura.flash.replay-scenario/v1",
  "id": "samsung-unlocked-warning-not-observed",
  "procedureId": "samsung-galaxy-xr-ayke-to-ayia-rollback-unlock",
  "flowId": "ayia-oem-unlock",
  "simulateDisabled": true,
  "clock": {
    "startTimestamp": "2026-09-27T12:00:00.000Z",
    "tickMs": 10
  },
  "operationDurations": [
    {
      "operationId": "probe-model",
      "durationMs": 100
    },
    {
      "operationId": "probe-build",
      "durationMs": 110
    },
    {
      "operationId": "probe-csc",
      "durationMs": 120
    },
    {
      "operationId": "enable-developer-options",
      "durationMs": 130
    },
    {
      "operationId": "enable-oem-unlocking",
      "durationMs": 140
    },
    {
      "operationId": "enter-oem-unlock-confirmation",
      "durationMs": 150
    },
    {
      "operationId": "accept-oem-unlock-and-wipe",
      "durationMs": 160
    },
    {
      "operationId": "reconnect-after-unlock",
      "durationMs": 170
    },
    {
      "operationId": "verify-ayia-after-unlock",
      "durationMs": 180
    },
    {
      "operationId": "enter-post-unlock-download-mode",
      "durationMs": 190
    },
    {
      "operationId": "observe-post-unlock-download-u1",
      "durationMs": 200
    },
    {
      "operationId": "observe-unlocked-warning",
      "durationMs": 210
    },
    {
      "operationId": "record-unlock-unverified",
      "durationMs": 220
    }
  ],
  "adapterCapabilities": [],
  "inputs": [
    {
      "name": "device",
      "type": "device-ref",
      "value": "simulated-sm-i610"
    },
    {
      "name": "expected-csc",
      "type": "string",
      "value": "SIM"
    },
    {
      "name": "expected-source-build",
      "type": "string",
      "value": "I610UEU1AYIA"
    },
    {
      "name": "expected-current-binary",
      "type": "string",
      "value": "Samsung Official"
    },
    {
      "name": "expected-system-status",
      "type": "string",
      "value": "Official"
    },
    {
      "name": "expected-oem-lock",
      "type": "string",
      "value": "ON"
    },
    {
      "name": "expected-post-unlock-oem-lock",
      "type": "string",
      "value": "OFF"
    },
    {
      "name": "expected-frp-lock",
      "type": "string",
      "value": "OFF"
    },
    {
      "name": "expected-kg-status",
      "type": "string",
      "value": "NORMAL"
    },
    {
      "name": "expected-warranty-void",
      "type": "string",
      "value": "SIMULATED-PRE-CAPTURE"
    },
    {
      "name": "expected-post-unlock-warranty-void",
      "type": "string",
      "value": "SIMULATED-POST-CAPTURE"
    },
    {
      "name": "expected-secure-download",
      "type": "string",
      "value": "ENABLED"
    },
    {
      "name": "confirm-simulated-oem-unlock-wipe",
      "type": "boolean",
      "value": true
    }
  ],
  "responses": [
    {
      "kind": "success",
      "operationId": "probe-model",
      "outputs": [
        {
          "name": "value",
          "type": "string",
          "value": "SM-I610"
        }
      ]
    },
    {
      "kind": "success",
      "operationId": "probe-build",
      "outputs": [
        {
          "name": "value",
          "type": "string",
          "value": "I610UEU1AYIA"
        }
      ]
    },
    {
      "kind": "success",
      "operationId": "probe-csc",
      "outputs": [
        {
          "name": "value",
          "type": "string",
          "value": "SIM"
        }
      ]
    },
    {
      "kind": "success",
      "operationId": "enable-developer-options",
      "outputs": [
        {
          "name": "acknowledged",
          "type": "boolean",
          "value": true
        }
      ]
    },
    {
      "kind": "success",
      "operationId": "enable-oem-unlocking",
      "outputs": [
        {
          "name": "acknowledged",
          "type": "boolean",
          "value": true
        }
      ]
    },
    {
      "kind": "success",
      "operationId": "enter-oem-unlock-confirmation",
      "outputs": [
        {
          "name": "acknowledged",
          "type": "boolean",
          "value": true
        }
      ]
    },
    {
      "kind": "success",
      "operationId": "accept-oem-unlock-and-wipe",
      "outputs": [
        {
          "name": "acknowledged",
          "type": "boolean",
          "value": true
        }
      ]
    },
    {
      "kind": "success",
      "operationId": "reconnect-after-unlock",
      "outputs": [
        {
          "name": "reconnectedDevice",
          "type": "device-ref",
          "value": "simulated-sm-i610-after-unlock"
        }
      ]
    },
    {
      "kind": "success",
      "operationId": "verify-ayia-after-unlock",
      "outputs": [
        {
          "name": "value",
          "type": "string",
          "value": "I610UEU1AYIA"
        }
      ]
    },
    {
      "kind": "success",
      "operationId": "enter-post-unlock-download-mode",
      "outputs": [
        {
          "name": "acknowledged",
          "type": "boolean",
          "value": true
        }
      ]
    },
    {
      "kind": "success",
      "operationId": "observe-post-unlock-download-u1",
      "outputs": [
        {
          "name": "productName",
          "type": "string",
          "value": "SM-I610"
        },
        {
          "name": "currentBinary",
          "type": "string",
          "value": "Samsung Official"
        },
        {
          "name": "systemStatus",
          "type": "string",
          "value": "Official"
        },
        {
          "name": "oemLock",
          "type": "string",
          "value": "OFF"
        },
        {
          "name": "frpLock",
          "type": "string",
          "value": "OFF"
        },
        {
          "name": "kgStatus",
          "type": "string",
          "value": "NORMAL"
        },
        {
          "name": "rpSwrev",
          "type": "string",
          "value": "U1"
        },
        {
          "name": "warrantyVoid",
          "type": "string",
          "value": "SIMULATED-POST-CAPTURE"
        },
        {
          "name": "secureDownload",
          "type": "string",
          "value": "ENABLED"
        }
      ]
    },
    {
      "kind": "failure",
      "operationId": "observe-unlocked-warning",
      "failureClass": "manual-action-declined"
    },
    {
      "kind": "success",
      "operationId": "record-unlock-unverified",
      "outputs": [
        {
          "name": "acknowledged",
          "type": "boolean",
          "value": true
        }
      ]
    }
  ],
  "expected": {
    "terminalStateId": "unlock-unverified",
    "eventKinds": [
      "session-start",
      "confirmation",
      "operation-would-execute",
      "operation-success",
      "operation-would-execute",
      "operation-success",
      "operation-would-execute",
      "operation-success",
      "operation-would-execute",
      "operation-success",
      "operation-would-execute",
      "operation-success",
      "operation-would-execute",
      "operation-success",
      "operation-would-execute",
      "state-transition",
      "operation-success",
      "operation-would-execute",
      "state-transition",
      "operation-success",
      "operation-would-execute",
      "operation-success",
      "operation-would-execute",
      "operation-success",
      "operation-would-execute",
      "state-transition",
      "operation-success",
      "operation-would-execute",
      "operation-failure",
      "recovery-start",
      "operation-would-execute",
      "state-transition",
      "operation-success",
      "session-end"
    ],
    "errorCode": "manual-action-declined"
  }
}
