{
  "schema": "org.mura.flash.replay-scenario/v1",
  "id": "samsung-download-entry-unresolved",
  "procedureId": "samsung-galaxy-xr-ayke-to-ayia-rollback-unlock",
  "flowId": "u2-rollback-protected",
  "simulateDisabled": true,
  "clock": {
    "startTimestamp": "2026-09-27T12:00:00.000Z",
    "tickMs": 10
  },
  "operationDurations": [
    {
      "operationId": "probe-model",
      "durationMs": 100
    },
    {
      "operationId": "probe-build",
      "durationMs": 110
    },
    {
      "operationId": "probe-csc",
      "durationMs": 120
    },
    {
      "operationId": "enter-download-mode",
      "durationMs": 130
    },
    {
      "operationId": "record-download-entry-unresolved",
      "durationMs": 140
    }
  ],
  "adapterCapabilities": [],
  "inputs": [
    {
      "name": "device",
      "type": "device-ref",
      "value": "simulated-sm-i610"
    },
    {
      "name": "expected-csc",
      "type": "string",
      "value": "SIM"
    },
    {
      "name": "expected-source-build",
      "type": "string",
      "value": "I610UEU2AZCI"
    },
    {
      "name": "expected-current-binary",
      "type": "string",
      "value": "Samsung Official"
    },
    {
      "name": "expected-system-status",
      "type": "string",
      "value": "Official"
    },
    {
      "name": "expected-oem-lock",
      "type": "string",
      "value": "ON"
    },
    {
      "name": "expected-post-unlock-oem-lock",
      "type": "string",
      "value": "OFF"
    },
    {
      "name": "expected-frp-lock",
      "type": "string",
      "value": "OFF"
    },
    {
      "name": "expected-kg-status",
      "type": "string",
      "value": "NORMAL"
    },
    {
      "name": "expected-warranty-void",
      "type": "string",
      "value": "SIMULATED-PRE-CAPTURE"
    },
    {
      "name": "expected-post-unlock-warranty-void",
      "type": "string",
      "value": "SIMULATED-POST-CAPTURE"
    },
    {
      "name": "expected-secure-download",
      "type": "string",
      "value": "ENABLED"
    }
  ],
  "responses": [
    {
      "kind": "success",
      "operationId": "probe-model",
      "outputs": [
        {
          "name": "value",
          "type": "string",
          "value": "SM-I610"
        }
      ]
    },
    {
      "kind": "success",
      "operationId": "probe-build",
      "outputs": [
        {
          "name": "value",
          "type": "string",
          "value": "I610UEU2AZCI"
        }
      ]
    },
    {
      "kind": "success",
      "operationId": "probe-csc",
      "outputs": [
        {
          "name": "value",
          "type": "string",
          "value": "SIM"
        }
      ]
    },
    {
      "kind": "failure",
      "operationId": "enter-download-mode",
      "failureClass": "manual-action-declined"
    },
    {
      "kind": "success",
      "operationId": "record-download-entry-unresolved",
      "outputs": [
        {
          "name": "acknowledged",
          "type": "boolean",
          "value": true
        }
      ]
    }
  ],
  "expected": {
    "terminalStateId": "download-entry-unresolved",
    "eventKinds": [
      "session-start",
      "operation-would-execute",
      "operation-success",
      "operation-would-execute",
      "operation-success",
      "operation-would-execute",
      "operation-success",
      "operation-would-execute",
      "operation-failure",
      "recovery-start",
      "operation-would-execute",
      "state-transition",
      "operation-success",
      "session-end"
    ],
    "errorCode": "manual-action-declined"
  }
}
